      -----------------------------------------------------------      
     |                   =====================                   |     
     |                           x T B                           |     
     |                   =====================                   |     
     |                         S. Grimme                         |     
     |          Mulliken Center for Theoretical Chemistry        |     
     |                    University of Bonn                     |     
      -----------------------------------------------------------      

   * xtb version 6.2.2 (655bc02) compiled by 'ehlert@majestix' on 2019-12-09

   This program is distributed in the hope that it will be useful,
   but WITHOUT ANY WARRANTY; without even the implied warranty of
   MERCHANTABILITY or FITNESS FOR A PARTICULAR PURPOSE.
   
   FOR NON-COMMERCIAL, ACADEMIA USE ONLY.
   
   Cite this work as:
   * S. Grimme, C. Bannwarth, P. Shushkov, J. Chem. Theory Comput., 2017,
     13, 1989-2009. DOI: 10.1021/acs.jctc.7b00118
   * C. Bannwarth, S. Ehlert and S. Grimme., J. Chem. Theory Comput., 2019,
     15, 1652-1671. DOI: 10.1021/acs.jctc.8b01176
   * P. Pracht, E. Caldeweyher, S. Ehlert, S. Grimme, ChemRxiv, 2019, preprint.
     DOI: 10.26434/chemrxiv.8326202.v1
   
   for DFT-D4:
   * E. Caldeweyher, C. Bannwarth and S. Grimme, J. Chem. Phys., 2017,
     147, 034112. DOI: 10.1063/1.4993215
   * E. Caldeweyher, S. Ehlert, A. Hansen, H. Neugebauer, S. Spicher,
     C. Bannwarth and S. Grimme, J. Chem. Phys., 2019, 150, 154122.
     DOI: 10.1063/1.5090222
   
   for sTDA-xTB:
   * S. Grimme and C. Bannwarth, J. Chem. Phys., 2016, 145, 054103.
     DOI: 10.1063/1.4959605
   
   in the mass-spec context:
   * V. Asgeirsson, C. Bauer and S. Grimme, Chem. Sci., 2017, 8, 4879.
     DOI: 10.1039/c7sc00601b
   
   for metadynamics refer to:
   * S. Grimme, J. Chem. Theory Comput., 2019, 155, 2847-2862
     DOI: 10.1021/acs.jctc.9b00143
   
   with help from (in alphabetical order)
   C. Bannwarth, F. Bohle, G. Brandenburg, E. Caldeweyher, M. Checinski,
   S. Dohm, S. Ehlert, S. Ehrlich, F. März, H. Neugebauer, J. Pisarek,
   P. Pracht, P. Shushkov, and S. Spicher.
   
 * started run on 2022/07/13 at 14:55:37.678     

           -------------------------------------------------
          |                Calculation Setup                |
           -------------------------------------------------

          program call               : xtb -c 0 -u 0 input.xyz --opt normal --molden
          coordinate file            : input.xyz
          omp threads                :                     8
          number of atoms            :                    12
          number of electrons        :                    30
          charge                     :                     0
          spin                       :                   0.0
          first test random number   :      0.67137525885687


########################################################################
# WARNING! Please study the warnings concerning your input carefully
#  - XTBHOME is not set, using HOME instead
#  - XTBPATH is not set, using XTBHOME instead
########################################################################

           ------------------------------------------------- 
          |                 G F N 2 - x T B                 |
          | Geometry, Frequencies, Noncovalent interactions |
          |            JCTC 2019 parametrisation            |
           ------------------------------------------------- 
             k(s)              :                1.8500
             k(p)              :                2.2300
             k(d)              :                2.2300
             k(f)              :                2.0000
             kEN (H0ij)        :               -2.0000
             D4 a1             :                0.5200
             D4 a2             :                5.0000
             D4 s6             :                1.0000
             D4 s8             :                2.7000
             D4 s9             :                5.0000
             alphaj            :                2.0000

  Z AO/shell   Hii/eV     exponent
  1     Wed Apr 25 08:07:45 CEST 2018   EN: 2.200 GM2: 0.406  GM3: 0.0800  RAES: 1.40
     1s    -10.707211    1.230000
  6     Wed Apr 25 08:07:45 CEST 2018   EN: 2.550 GM2: 0.538  GM3: 0.1500  RAES: 3.00
     2s    -13.970922    2.096432
     2p    -10.063292    1.800000

           ------------------------------------------------- 
          |        Self-Consistent Charge Iterations        |
           ------------------------------------------------- 
q/qsh data taken from xtbrestart
CAMM data taken from xtbrestart

          ...................................................
          :                      SETUP                      :
          :.................................................:
          :  # basis functions                  30          :
          :  # atomic orbitals                  30          :
          :  # shells                           18          :
          :  # electrons                        30          :
          :  max. iterations                   250          :
          :  Hamiltonian                  GFN2-xTB          :
          :  restarted?                       true          :
          :  GBSA solvation                  false          :
          :  PC potential                    false          :
          :  electronic temp.          300.0000000     K    :
          :  accuracy                    1.0000000          :
          :  -> integral cutoff          0.2500000E+02      :
          :  -> integral neglect         0.1000000E-07      :
          :  -> SCF convergence          0.1000000E-05 Eh   :
          :  -> wf. convergence          0.1000000E-03 e    :
          :  Broyden damping             0.4000000          :
          ...................................................

 iter      E             dE          RMSdq      gap      omega  full diag
   1    -16.1773239 -0.161773E+02  0.133E-01    4.83       0.0  T
   2    -16.1773245 -0.578273E-06  0.794E-02    4.83       1.0  T
   3    -16.1773247 -0.183258E-06  0.344E-03    4.83       8.4  T
   4    -16.1773247 -0.783302E-08  0.142E-03    4.83      20.4  T
   5    -16.1773247 -0.182773E-09  0.569E-05    4.83     507.3  T
   6    -16.1773247 -0.353850E-11  0.288E-05    4.83    1003.4  T

   *** convergence criteria satisfied after 6 iterations ***

         #    Occupation            Energy/Eh            Energy/eV
      -------------------------------------------------------------
         1        2.0000           -0.6387784             -17.3820
       ...           ...                  ...                  ...
         9        2.0000           -0.4756403             -12.9428
        10        2.0000           -0.4756399             -12.9428
        11        2.0000           -0.4718308             -12.8392
        12        2.0000           -0.4219110             -11.4808
        13        2.0000           -0.4219099             -11.4808
        14        2.0000           -0.4009393             -10.9101
        15        2.0000           -0.4009390             -10.9101 (HOMO)
        16                         -0.2235916              -6.0842 (LUMO)
        17                         -0.2235908              -6.0842
        18                         -0.0961298              -2.6158
        19                          0.1106957               3.0122
        20                          0.1225454               3.3346
       ...                                ...                  ...
        30                          0.6432943              17.5049
      -------------------------------------------------------------
                  HL-Gap            0.1773474 Eh            4.8259 eV
             Fermi-level           -0.3122653 Eh           -8.4972 eV

 SCC (total)                   0 d,  0 h,  0 min,  0.009 sec
 SCC setup                      ...        0 min,  0.000 sec (  0.971%)
 Dispersion                     ...        0 min,  0.000 sec (  0.788%)
 integral evaluation            ...        0 min,  0.001 sec (  5.950%)
 zeroth order Hamiltonian       ...        0 min,  0.000 sec (  0.412%)
 iterations                     ...        0 min,  0.002 sec ( 19.657%)
 molecular gradient             ...        0 min,  0.001 sec (  9.155%)
 printout                       ...        0 min,  0.005 sec ( 62.794%)

         :::::::::::::::::::::::::::::::::::::::::::::::::::::
         ::                     SUMMARY                     ::
         :::::::::::::::::::::::::::::::::::::::::::::::::::::
         :: total energy             -15.878843475804 Eh    ::
         :: gradient norm              0.019162744511 Eh/a0 ::
         :: HOMO-LUMO gap              4.825868992956 eV    ::
         ::.................................................::
         :: SCC energy               -16.177324701435 Eh    ::
         :: -> isotropic ES            0.000751761889 Eh    ::
         :: -> anisotropic ES          0.002690220165 Eh    ::
         :: -> anisotropic XC          0.013011881390 Eh    ::
         :: -> dispersion             -0.007987753028 Eh    ::
         :: repulsion energy           0.298474196495 Eh    ::
         :: add. restraining           0.000000000000 Eh    ::
         :::::::::::::::::::::::::::::::::::::::::::::::::::::

      ----------------------------------------------------------- 
     |                   =====================                   |
     |                        A N C O P T                        |
     |                   =====================                   |
     |               Approximate Normal Coordinate               |
     |                Rational Function Optimizer                |
      ----------------------------------------------------------- 

          ...................................................
          :                      SETUP                      :
          :.................................................:
          :   optimization level            normal          :
          :   max. optcycles                   200          :
          :   ANC micro-cycles                  20          :
          :   degrees of freedom                30          :
          :.................................................:
          :   RF solver                   davidson          :
          :   write xtbopt.log                true          :
          :   linear?                        false          :
          :   energy convergence         0.5000000E-05 Eh   :
          :   grad. convergence          0.1000000E-02 Eh/α :
          :   maximium RF displ.         1.0000000          :
          :   Hlow (freq-cutoff)         0.1000000E-01      :
          :   Hmax (freq-cutoff)         5.0000000          :
          :   S6 in model hess.         20.0000000          :
          ...................................................

generating ANC from model Hessian ...
Using Lindh-Hessian (1995)
 Shifting diagonal of input Hessian by   0.000000000000000E+000
 Lowest  eigenvalues of input Hessian
   -0.000000   -0.000000    0.000000    0.000000    0.000000    0.000000
    0.013826    0.013860    0.022878    0.024320    0.063060    0.063361
    0.091594    0.091649    0.095680    0.095740    0.096517    0.120223
 Highest eigenvalues
    1.329222    1.540518    1.540552    1.837948    1.942221    1.942387
 

........................................................................
.............................. CYCLE    1 ..............................
........................................................................
   1    -16.1773247 -0.161773E+02  0.169E-05    4.83       0.0  T
   2    -16.1773247 -0.337508E-12  0.105E-05    4.83    2748.5  T
   3    -16.1773247 -0.259348E-12  0.629E-06    4.83    4587.0  T
     SCC iter.                  ...        0 min,  0.001 sec
     gradient                   ...        0 min,  0.001 sec
 * total energy  :   -15.8788435 Eh     change       -0.6866347E-09 Eh
   gradient norm :     0.0191628 Eh/α   predicted     0.0000000E+00 (-100.00%)
   displ. norm   :     0.0799400 α      lambda       -0.1412052E-02
   maximum displ.:     0.0796274 α      in ANC's #16, #24, #17, ...

........................................................................
.............................. CYCLE    2 ..............................
........................................................................
   1    -16.1944478 -0.161944E+02  0.483E-02    4.92       0.0  T
   2    -16.1944479 -0.120097E-06  0.295E-02    4.92       1.0  T
   3    -16.1944479 -0.468465E-07  0.165E-03    4.92      17.5  T
   4    -16.1944479 -0.135186E-08  0.625E-04    4.92      46.2  T
     SCC iter.                  ...        0 min,  0.001 sec
     gradient                   ...        0 min,  0.001 sec
 * total energy  :   -15.8796311 Eh     change       -0.7875903E-03 Eh
   gradient norm :     0.0019070 Eh/α   predicted    -0.7105351E-03 (  -9.78%)
   displ. norm   :     0.0151193 α      lambda       -0.1920165E-04
   maximum displ.:     0.0151187 α      in ANC's #16, #24, #17, ...

........................................................................
.............................. CYCLE    3 ..............................
........................................................................
   1    -16.1976324 -0.161976E+02  0.847E-03    4.94       0.0  T
   2    -16.1976324 -0.142862E-07  0.496E-03    4.94       5.8  T
   3    -16.1976324 -0.135693E-08  0.510E-04    4.94      56.6  T
   4    -16.1976324 -0.313012E-09  0.136E-04    4.94     212.9  T
     SCC iter.                  ...        0 min,  0.001 sec
     gradient                   ...        0 min,  0.001 sec
 * total energy  :   -15.8796380 Eh     change       -0.6982145E-05 Eh
   gradient norm :     0.0010954 Eh/α   predicted    -0.9603020E-05 (  37.54%)
   displ. norm   :     0.0051414 α      lambda       -0.3502660E-05
   maximum displ.:     0.0051284 α      in ANC's #16, #24, #5, ...

........................................................................
.............................. CYCLE    4 ..............................
........................................................................
   1    -16.1965478 -0.161965E+02  0.302E-03    4.93       0.0  T
   2    -16.1965478 -0.352134E-09  0.183E-03    4.93      15.8  T
   3    -16.1965478 -0.456950E-10  0.153E-04    4.93     189.2  T
   4    -16.1965478 -0.147569E-09  0.725E-05    4.93     397.9  T
     SCC iter.                  ...        0 min,  0.001 sec
     gradient                   ...        0 min,  0.001 sec
 * total energy  :   -15.8796407 Eh     change       -0.2608365E-05 Eh
   gradient norm :     0.0000444 Eh/α   predicted    -0.1752400E-05 ( -32.82%)
   displ. norm   :     0.0000542 α      lambda        0.8850900E-09
   maximum displ.:     0.0000501 α      in ANC's #24, #16, #5, ...

   *** GEOMETRY OPTIMIZATION CONVERGED AFTER 4 ITERATIONS ***

------------------------------------------------------------------------
 total energy gain   :        -0.0007972 Eh       -0.5002 kcal/mol
 total RMSD          :         0.0259455 a0        0.0137 Å
 total power (kW/mol):        -0.5232499 (step) -131.0094 (real)
------------------------------------------------------------------------

 ANCopt (total)                0 d,  0 h,  0 min,  0.016 sec
 optimizer setup                ...        0 min,  0.000 sec (  0.407%)
 model hessian                  ...        0 min,  0.001 sec (  8.727%)
 ANC generation                 ...        0 min,  0.000 sec (  1.083%)
 coordinate transformation      ...        0 min,  0.000 sec (  0.136%)
 single point calculation       ...        0 min,  0.010 sec ( 61.130%)
 optimization log               ...        0 min,  0.004 sec ( 25.970%)
 hessian update                 ...        0 min,  0.000 sec (  0.157%)
 rational function              ...        0 min,  0.000 sec (  1.381%)

================
 final structure:
================
$coord
   -1.40944912413612    2.20626622287689    0.03277903651293      C 
    1.20327845841589    2.34381472801189    0.06189745639029      C 
    2.62894142134636    0.14982343513349    0.06076181052660      C 
    1.44187656366521   -2.18171579674068    0.03050786965471      C 
   -1.17085104887421   -2.31926382973731    0.00138945658511      C 
   -2.59651376516885   -0.12527256622297    0.00252510482805      C 
   -2.52194920004628    3.91832359810922    0.03366234861153      H 
    2.12959174010577    4.16320554603997    0.08550395533662      H 
    4.66775478927902    0.25715748981176    0.08348501428199      H 
    2.55437734388575   -3.89377252859398    0.02962459409104      H 
   -2.09716379937847   -4.13865505715786   -0.02221702553602      H 
   -4.63532719535443   -0.23260710378271   -0.02019808903108      H 
$end
 
 Bond Distances (Angstroems)
 ---------------------------
C1-C2=1.3846         C1-C6=1.3846         C1-H7=1.0805         C2-C1=1.3846         C2-C3=1.3846         C2-H8=1.0805         
C3-C2=1.3846         C3-C4=1.3846         C3-H9=1.0805         C4-C3=1.3846         C4-C5=1.3846         C4-H10=1.0805        
C5-C4=1.3846         C5-C6=1.3846         C5-H11=1.0805        C6-C1=1.3846         C6-C5=1.3846         C6-H12=1.0805        
H7-C1=1.0805         H8-C2=1.0805         H9-C3=1.0805         H10-C4=1.0805        H11-C5=1.0805        H12-C6=1.0805        
 C  H  Rav=1.0805 sigma=0.0000  Rmin=1.0805  Rmax=1.0805     6
 C  C  Rav=1.3846 sigma=0.0000  Rmin=1.3846  Rmax=1.3846     6
 
 selected bond angles (degree)
 --------------------
C6-C1-C2=120.00                H7-C1-C2=120.00                H7-C1-C6=120.00                C3-C2-C1=120.00                
H8-C2-C1=120.00                H8-C2-C3=120.00                C4-C3-C2=120.00                H9-C3-C2=120.00                
H9-C3-C4=120.00                C5-C4-C3=120.00                H10-C4-C3=120.00               H10-C4-C5=120.00               
C6-C5-C4=120.00                H11-C5-C4=120.00               H11-C5-C6=120.00               C5-C6-C1=120.00                
H12-C6-C1=120.00               H12-C6-C5=120.00               
 
 selected dihedral angles (degree)
 ---------------------------------
C3-C2-C1-C6=  0.00            C3-C2-C1-H7=180.00            H8-C2-C1-C6=180.00            H8-C2-C1-H7=  0.00            
C4-C3-C2-C1=  0.00            C4-C3-C2-H8=180.00            H9-C3-C2-C1=180.00            H9-C3-C2-H8=  0.00            
C5-C4-C3-C2=  0.00            C5-C4-C3-H9=180.00            H10-C4-C3-C2=180.00           H10-C4-C3-H9=  0.00           
C6-C5-C4-C3=  0.00            C6-C5-C4-H10=180.00           H11-C5-C4-C3=180.00           H11-C5-C4-H10=  0.00          
C5-C6-C1-C2=  0.00            C5-C6-C1-H7=180.00            H12-C6-C1-C2=180.00           H12-C6-C1-H7=  0.00           
C1-C6-C5-C4=  0.00            C1-C6-C5-H11=180.00           H12-C6-C5-C4=180.00           H12-C6-C5-H11=  0.00          
           -------------------------------------------------
          |                Final Singlepoint                |
           -------------------------------------------------

          ...................................................
          :                      SETUP                      :
          :.................................................:
          :  # basis functions                  30          :
          :  # atomic orbitals                  30          :
          :  # shells                           18          :
          :  # electrons                        30          :
          :  max. iterations                   250          :
          :  Hamiltonian                  GFN2-xTB          :
          :  restarted?                      false          :
          :  GBSA solvation                  false          :
          :  PC potential                    false          :
          :  electronic temp.          300.0000000     K    :
          :  accuracy                    1.0000000          :
          :  -> integral cutoff          0.2500000E+02      :
          :  -> integral neglect         0.1000000E-07      :
          :  -> SCF convergence          0.1000000E-05 Eh   :
          :  -> wf. convergence          0.1000000E-03 e    :
          :  Broyden damping             0.4000000          :
          ...................................................

 iter      E             dE          RMSdq      gap      omega  full diag
   1    -16.1965478 -0.161965E+02  0.977E-06    4.93       0.0  T
   2    -16.1965478 -0.202505E-12  0.578E-06    4.93    4998.6  T
   3    -16.1965478 -0.710543E-13  0.347E-06    4.93    8329.4  T

   *** convergence criteria satisfied after 3 iterations ***

         #    Occupation            Energy/Eh            Energy/eV
      -------------------------------------------------------------
         1        2.0000           -0.6416563             -17.4604
       ...           ...                  ...                  ...
         9        2.0000           -0.4763504             -12.9622
        10        2.0000           -0.4763504             -12.9622
        11        2.0000           -0.4747555             -12.9188
        12        2.0000           -0.4213971             -11.4668
        13        2.0000           -0.4213971             -11.4668
        14        2.0000           -0.4025257             -10.9533
        15        2.0000           -0.4025257             -10.9533 (HOMO)
        16                         -0.2211955              -6.0190 (LUMO)
        17                         -0.2211954              -6.0190
        18                         -0.0899218              -2.4469
        19                          0.1180178               3.2114
        20                          0.1377101               3.7473
       ...                                ...                  ...
        30                          0.6741203              18.3437
      -------------------------------------------------------------
                  HL-Gap            0.1813302 Eh            4.9342 eV
             Fermi-level           -0.3118606 Eh           -8.4862 eV

 SCC (total)                   0 d,  0 h,  0 min,  0.006 sec
 SCC setup                      ...        0 min,  0.000 sec (  1.082%)
 Dispersion                     ...        0 min,  0.000 sec (  0.680%)
 integral evaluation            ...        0 min,  0.000 sec (  7.605%)
 zeroth order Hamiltonian       ...        0 min,  0.000 sec (  0.495%)
 iterations                     ...        0 min,  0.001 sec ( 13.090%)
 molecular gradient             ...        0 min,  0.001 sec ( 12.584%)
 printout                       ...        0 min,  0.004 sec ( 64.061%)

         :::::::::::::::::::::::::::::::::::::::::::::::::::::
         ::                     SUMMARY                     ::
         :::::::::::::::::::::::::::::::::::::::::::::::::::::
         :: total energy             -15.879640657013 Eh    ::
         :: gradient norm              0.000043857673 Eh/a0 ::
         :: HOMO-LUMO gap              4.934244835651 eV    ::
         ::.................................................::
         :: SCC energy               -16.196547845731 Eh    ::
         :: -> isotropic ES            0.000791496566 Eh    ::
         :: -> anisotropic ES          0.002517684070 Eh    ::
         :: -> anisotropic XC          0.012388857356 Eh    ::
         :: -> dispersion             -0.008019530580 Eh    ::
         :: repulsion energy           0.316900404537 Eh    ::
         :: add. restraining           0.000000000000 Eh    ::
         :::::::::::::::::::::::::::::::::::::::::::::::::::::

           -------------------------------------------------
          |                Property Printout                |
           -------------------------------------------------

    * Orbital Energies and Occupations

         #    Occupation            Energy/Eh            Energy/eV
      -------------------------------------------------------------
         1        2.0000           -0.6416563             -17.4604
       ...           ...                  ...                  ...
         3        2.0000           -0.6114930             -16.6396
         4        2.0000           -0.5690028             -15.4834
         5        2.0000           -0.5690028             -15.4834
         6        2.0000           -0.5311832             -14.4542
         7        2.0000           -0.4950034             -13.4697
         8        2.0000           -0.4894024             -13.3173
         9        2.0000           -0.4763504             -12.9622
        10        2.0000           -0.4763504             -12.9622
        11        2.0000           -0.4747555             -12.9188
        12        2.0000           -0.4213971             -11.4668
        13        2.0000           -0.4213971             -11.4668
        14        2.0000           -0.4025257             -10.9533
        15        2.0000           -0.4025257             -10.9533 (HOMO)
        16                         -0.2211955              -6.0190 (LUMO)
        17                         -0.2211954              -6.0190
        18                         -0.0899218              -2.4469
        19                          0.1180178               3.2114
        20                          0.1377101               3.7473
        21                          0.1734864               4.7208
        22                          0.1734865               4.7208
        23                          0.2027065               5.5159
        24                          0.2027065               5.5159
        25                          0.4132476              11.2450
        26                          0.4132477              11.2450
       ...                                ...                  ...
        30                          0.6741203              18.3437
      -------------------------------------------------------------
                  HL-Gap            0.1813302 Eh            4.9342 eV
             Fermi-level           -0.3118606 Eh           -8.4862 eV

     #   Z        covCN         q      C6AA      α(0)
     1   6 C      2.920    -0.029    28.718     8.788
     2   6 C      2.920    -0.029    28.718     8.788
     3   6 C      2.920    -0.029    28.718     8.788
     4   6 C      2.920    -0.029    28.718     8.788
     5   6 C      2.920    -0.029    28.718     8.788
     6   6 C      2.920    -0.029    28.718     8.788
     7   1 H      0.926     0.029     2.604     2.524
     8   1 H      0.926     0.029     2.604     2.524
     9   1 H      0.926     0.029     2.604     2.524
    10   1 H      0.926     0.029     2.604     2.524
    11   1 H      0.926     0.029     2.604     2.524
    12   1 H      0.926     0.029     2.604     2.524

 Mol. C6AA /au·bohr⁶  :       1749.469356
 Mol. C8AA /au·bohr⁸  :      42661.671668
 Mol. α(0) /au        :         67.869835


Wiberg/Mayer (AO) data.
largest (>0.10) Wiberg bond orders for each atom
          total WBO             WBO to atom ...
     1  C   3.993        C    6 1.441    C    2 1.441    H    7 0.972    C    4 0.114
     2  C   3.993        C    3 1.441    C    1 1.441    H    8 0.972    C    5 0.114
     3  C   3.993        C    2 1.441    C    4 1.441    H    9 0.972    C    6 0.114
     4  C   3.993        C    5 1.441    C    3 1.441    H   10 0.972    C    1 0.114
     5  C   3.993        C    4 1.441    C    6 1.441    H   11 0.972    C    2 0.114
     6  C   3.993        C    1 1.441    C    5 1.441    H   12 0.972    C    3 0.114
     7  H   0.999        C    1 0.972
     8  H   0.999        C    2 0.972
     9  H   0.999        C    3 0.972
    10  H   0.999        C    4 0.972
    11  H   0.999        C    5 0.972
    12  H   0.999        C    6 0.972

MOs/occ written to file <molden.input>


molecular dipole:
                 x           y           z       tot (Debye)
 q only:       -0.000       0.000      -0.000
   full:       -0.000       0.000       0.000       0.000
molecular quadrupole (traceless):
                xx          xy          yy          xz          yz          zz
 q only:        0.640      -0.000       0.640       0.021       0.014      -1.280
  q+dip:        2.668      -0.001       2.668       0.086       0.060      -5.336
   full:        1.334      -0.000       1.334       0.043       0.030      -2.667

           -------------------------------------------------
          |                Geometry Summary                 |
           -------------------------------------------------

      molecular mass/u    :       78.1120599
   center of mass at/Å    :        0.0085800       0.0064958       0.0167450
  moments of inertia/u·Å² :        0.8745179E+02   0.8745179E+02   0.1749036E+03
rotational constants/cm⁻¹ :        0.1927649E+00   0.1927649E+00   0.9638243E-01

 * 12 selected distances

     #   Z        #   Z                                     value/Å
     1   6 C      2   6 C                                 1.3845964
     2   6 C      3   6 C                                 1.3845965 (max)
     3   6 C      4   6 C                                 1.3845965
     4   6 C      5   6 C                                 1.3845964
     1   6 C      6   6 C                                 1.3845962
     5   6 C      6   6 C                                 1.3845964
     1   6 C      7   1 H                                 1.0804547
     2   6 C      8   1 H                                 1.0804546 (min)
     3   6 C      9   1 H                                 1.0804546
     4   6 C     10   1 H                                 1.0804547
     5   6 C     11   1 H                                 1.0804547
     6   6 C     12   1 H                                 1.0804547

 * 2 distinct bonds (by element types)

   Z      Z             #   av. dist./Å        max./Å        min./Å
   1 H    6 C           6     1.0804547     1.0804547     1.0804546
   6 C    6 C           6     1.3845964     1.3845965     1.3845962


optimized geometry written to: xtbopt.xyz


           -------------------------------------------------
          | TOTAL ENERGY              -15.879640657013 Eh   |
          | GRADIENT NORM               0.000043857673 Eh/α |
          | HOMO-LUMO GAP               4.934244835651 eV   |
           -------------------------------------------------

------------------------------------------------------------------------
 * finished run on 2022/07/13 at 14:55:37.780     
------------------------------------------------------------------------
 total:
 * wall-time:     0 d,  0 h,  0 min,  0.101 sec
 *  cpu-time:     0 d,  0 h,  0 min,  0.697 sec
 * ratio c/w:     6.875 speedup
 SCF:
 * wall-time:     0 d,  0 h,  0 min,  0.009 sec
 *  cpu-time:     0 d,  0 h,  0 min,  0.065 sec
 * ratio c/w:     7.393 speedup
 ANC optimizer:
 * wall-time:     0 d,  0 h,  0 min,  0.032 sec
 *  cpu-time:     0 d,  0 h,  0 min,  0.238 sec
 * ratio c/w:     7.474 speedup

